{
  "pilotId": "live-pilot:microsoft-graph-direct-grant-revocation",
  "status": "ready",
  "checkedAt": "2026-05-26T00:00:00.000Z",
  "checks": [
    {
      "name": "pilot_write_path_narrowly_scoped",
      "component": "connector",
      "status": "pass",
      "message": "Live pilot writes are opt-in and limited to one emergency-priority direct-grant revocation.",
      "evidence": {
        "connectorId": "microsoft-graph-live-revocation",
        "provider": "microsoft-graph",
        "operation": "revoke_native_grant",
        "scope": "single_resource_direct_grant",
        "maxActionsPerChange": 1,
        "resourceRisk": "moderate"
      }
    },
    {
      "name": "read_only_confidence_before_writes",
      "component": "read_only",
      "status": "pass",
      "message": "Read-only connector evidence is fresh, repeated, readback-verified, and drift-reviewed.",
      "evidence": {
        "successfulRuns": 3,
        "minSuccessfulRuns": 3,
        "evidenceAgeHours": 4,
        "maxEvidenceAgeHours": 24,
        "nativeReadbackVerified": true,
        "driftFindingsReviewed": true
      }
    },
    {
      "name": "approval_workflow_release_gate",
      "component": "approval",
      "status": "pass",
      "message": "Approval workflow requires separation of duties, expiring approval, and incident/break-glass blocking.",
      "evidence": {
        "requiredApproverRoles": ["resource-owner", "security-engineer"],
        "minApprovers": 2,
        "distinctApproverRoles": 2,
        "approvalExpiresMinutes": 30,
        "breakGlassProhibited": true,
        "incidentModeBlocksEnforcement": true
      }
    },
    {
      "name": "runtime_blocks_degraded_enforcement",
      "component": "runtime",
      "status": "pass",
      "message": "Runtime gates require durable queue, immutable audit, healthy connector/audit state, and revocation priority.",
      "evidence": {
        "connectorHealth": "healthy",
        "auditHealth": "healthy",
        "durableQueueRequired": true,
        "immutableAuditRequired": true,
        "degradedConnectorBlocksEnforcement": true,
        "degradedAuditBlocksEnforcement": true,
        "revocationsPrioritized": true
      }
    },
    {
      "name": "verification_and_rollback_hooks",
      "component": "verification",
      "status": "pass",
      "message": "Pilot writes require dry-run, pre/post readback, rollback hooks, drift review, and audit coverage.",
      "evidence": {
        "dryRunFirst": true,
        "preWriteReadback": true,
        "postWriteReadback": true,
        "compensationRequired": true,
        "rollbackPlanRef": "runbooks/policy-rollback.md",
        "missingAuditEvents": []
      }
    },
    {
      "name": "operational_runbooks_present",
      "component": "runbook",
      "status": "pass",
      "message": "Pilot readiness references emergency revocation, connector outage, decision outage, and rollback runbooks.",
      "evidence": {
        "runbookRefs": [
          "runbooks/emergency-revocation.md",
          "runbooks/connector-outage.md",
          "runbooks/decision-api-outage.md",
          "runbooks/policy-rollback.md"
        ],
        "missing": []
      }
    },
    {
      "name": "release_gate_ready_without_blockers",
      "component": "release_gate",
      "status": "pass",
      "message": "Release gate references retained readiness and approval evidence without outstanding blockers.",
      "evidence": {
        "status": "ready",
        "readinessReportRef": "deploy/live-enforcement-pilot/readiness-report.example.json",
        "releaseApprovalRef": "deploy/live-enforcement-pilot/evidence/release-approval.example.json",
        "outstandingBlockers": []
      }
    }
  ],
  "manifest": {
    "pilotId": "live-pilot:microsoft-graph-direct-grant-revocation",
    "environment": "pilot_candidate",
    "generatedAt": "2026-05-26T00:00:00.000Z",
    "connector": {
      "connectorId": "microsoft-graph-live-revocation",
      "provider": "microsoft-graph",
      "tenantBoundary": "tenant:pilot-redacted",
      "mode": "enforcement",
      "liveWritesOptIn": true,
      "allowedWriteScopes": ["GroupMember.ReadWrite.All"],
      "forbiddenWriteScopes": [
        "Directory.ReadWrite.All",
        "Files.ReadWrite.All",
        "RoleManagement.ReadWrite.Directory",
        "Sites.FullControl.All",
        "User.ReadWrite.All"
      ],
      "leastPrivilegeReviewRef": "deploy/live-enforcement-pilot/evidence/least-privilege-review.example.json"
    },
    "writePath": {
      "operation": "revoke_native_grant",
      "scope": "single_resource_direct_grant",
      "resourceRisk": "moderate",
      "maxActionsPerChange": 1,
      "revocationPriority": "emergency"
    },
    "readOnlyConfidence": {
      "minSuccessfulRuns": 3,
      "successfulRuns": 3,
      "maxEvidenceAgeHours": 24,
      "evidenceAgeHours": 4,
      "nativeReadbackVerified": true,
      "driftFindingsReviewed": true,
      "evidenceRefs": ["deploy/live-enforcement-pilot/evidence/read-only-confidence.example.json"]
    },
    "approvalWorkflow": {
      "requiredApproverRoles": ["resource-owner", "security-engineer"],
      "minApprovers": 2,
      "separationOfDuties": true,
      "changeTicketPattern": "^chg:live-pilot:[a-z0-9_:-]+$",
      "approvalExpiresMinutes": 30,
      "breakGlassProhibited": true,
      "incidentModeBlocksEnforcement": true,
      "evidenceRef": "deploy/live-enforcement-pilot/evidence/approval-workflow.example.json"
    },
    "runtimeGates": {
      "connectorHealth": "healthy",
      "auditHealth": "healthy",
      "durableQueueRequired": true,
      "immutableAuditRequired": true,
      "adminAuthorizationRequired": true,
      "healthSignalsRequired": true,
      "degradedConnectorBlocksEnforcement": true,
      "degradedAuditBlocksEnforcement": true,
      "revocationsPrioritized": true,
      "idempotencyRequired": true,
      "readinessReportRequired": true,
      "evidenceRefs": ["deploy/live-enforcement-pilot/evidence/runtime-gates.example.json"]
    },
    "verification": {
      "dryRunFirst": true,
      "preWriteReadback": true,
      "postWriteReadback": true,
      "compensationRequired": true,
      "rollbackPlanRef": "runbooks/policy-rollback.md",
      "driftReconciliationRequired": true,
      "auditEventTypes": [
        "connector.enforcement_readiness_checked",
        "provisioning.approved",
        "connector.permission_changed",
        "provisioning.rollback_available",
        "drift.finding_reviewed"
      ],
      "evidenceRefs": ["deploy/live-enforcement-pilot/evidence/verification-rollback.example.json"]
    },
    "runbookRefs": [
      "runbooks/emergency-revocation.md",
      "runbooks/connector-outage.md",
      "runbooks/decision-api-outage.md",
      "runbooks/policy-rollback.md"
    ],
    "releaseGate": {
      "status": "ready",
      "readinessReportRef": "deploy/live-enforcement-pilot/readiness-report.example.json",
      "releaseApprovalRef": "deploy/live-enforcement-pilot/evidence/release-approval.example.json",
      "outstandingBlockers": []
    },
    "evidenceRefs": [
      "deploy/live-enforcement-pilot/evidence/least-privilege-review.example.json",
      "deploy/live-enforcement-pilot/evidence/read-only-confidence.example.json",
      "deploy/live-enforcement-pilot/evidence/approval-workflow.example.json",
      "deploy/live-enforcement-pilot/evidence/runtime-gates.example.json",
      "deploy/live-enforcement-pilot/evidence/verification-rollback.example.json",
      "deploy/live-enforcement-pilot/evidence/release-approval.example.json"
    ],
    "version": "live-enforcement-pilot-manifest:v1"
  },
  "version": "live-enforcement-pilot-readiness:v1"
}
